"Menou d'Aulnay, Charles de","Menou d'Aulnay, Charles de",<Null>,Fort Anne NHSC,Annapolis Royal,Nova Scotia,"Governor of Acadia (1647-50), organized colonies at Port-Royal and Saint John","Gouverneur de l'Acadie (1647-1650), organisateur de colonies à Port-Royal et à Saint John",44.740872,-65.520326
"Mercier, Honoré","Mercier, Honoré",<Null>,<Null>,*    Sainte-Anne-de-la-Pérade,Quebec,"Premier of Quebec, 1887-91",Premier ministre du Québec (1887-1891),46.583319,-72.199999
"Merritt, William Hamilton","Merritt, William Hamilton",Welland Canals Parkway (formerly Government Road),lock #3 Welland Canal,St. Catharines,Ontario,"Industrialist, politician, led construction of the Welland Canal","Industriel, homme politique, dirigea la construction du canal Welland",43.155967,-79.194183
"Mills, David","Mills, David",315 King St.,in main corridor of the Kent County Building,Chatham,Ontario,Canadian Minister of the Interior (1876-78) and Minister of Justice (1897-1902),Ministre de l'Intérieur (1876-1878) et ministre de la Justice du Canada (1897-1902),42.404395,-82.190979
Misto-ha-a-Muska (Big Bear),Misto-ha-a-muska (Big Bear),<Null>,Fort Pitt Provincial Park,Fort Pitt,Saskatchewan,Leader of the Plains Cree; major figure in Canadian history; Northwest Rebellion 1885,Chef des Cris des Plaines; personnage important de l'histoire canadienne; Rébellion du Nord-Ouest,53.568439,-109.815242
"Mitchell, Mattie (Mathieu Michel)","Mitchell, Mattie (Mathieu Michel)",<Null>,Rocky Harbour,Gros Morne National Park of Canada,Newfoundland and Labrador,"Mi'kmaw hunter, guide and prospector; contribution to the exploration and mapping of Newfoundland","Chasseur, guide et prospecteur mi'kmaq; contribution à l'exploration et à la cartographie de Terre-Neuve",49.559294,-57.831517
"Mitchell, Peter","Mitchell, Peter",<Null>,<Null>,Newcastle,New Brunswick,"Father of Confederation, Prime Minister of New Brunswick (1866-67)","Père de la Confédération, premier ministre du Nouveau-Brunswick (1866-1867)",47,-65.566667
"Monck, Sir Charles Stanley (Lord Monck)","Monck, sir Charles Stanley (baron Monck)",<Null>,Rideau Hall and Landscaped Grounds NHSC,Ottawa,Ontario,Governor General of British North America (1861-67),Gouverneur général de l'Amérique du Nord britannique (1861-1867),45.444183,-75.68725
"Montgomery, Lucy Maud","Montgomery, Lucy Maud",Route 6,On brick cairn near Green Glables,Cavendish,Prince Edward Island,"Novelist, writer of world-renowned ""Anne of Green Gables"" books set in Prince Edward Island","Romancière, auteur des livres célèbres à travers le monde «Anne of Green Gables», dont l'action se passe dans l'Île-du-Prince-Édouard",46.488626,-63.382114
"Montizambert, Dr. Frédérick","Montizambert, docteur Frédérick",<Null>,inside the rear door to the Parks Canada Interpretation Centre,Grosse-Île,Quebec,Developed quarantine stations which protected Canadians from deadly epidemics,A créé des stations de quarantaine qui ont protégé les Canadiens des épidémies mortelles,47.026987,-70.672019
"Moodie, Susanna","Moodie, Susanna",114 Bridge Street West,Susanna Moodie Cottage,Belleville,Ontario,"Leading author of 1850s in Ontario, wrote ""Roughing it in the Bush""","Importante femme de lettres de l'Ontario dans les années 1850, auteure de «Roughing it in the Bush»",44.1614,-77.393517
"Moody, Sewell Prescott","Moody, Sewell Prescott",2nd and Moody Avenue,Moodyville Park,North Vancouver,British Columbia,"Entrepreneur, established sawmills in Vancouver area (1865-75)","Homme d'affaires, fonda des scieries dans la région de Vancouver (1865-1875)",49.308017,-123.0591
"Morenz, Howie","Morenz, Howie",1260 De la Gauchetière St. West,"Bell Centre (Air Canada Suite, section 224)",Montréal,Quebec,"Montréal Canadiens hockey star, helped the team win 3 Stanley Cups","Joueur de hockey célèbre, aida les Canadiens de Montréal à remporter trois fois la coupe Stanley",45.496016,-73.569927
"Morice, Adrien-Gabriel, O. M. I.","Morice, Adrien-Gabriel, o. m. i.",<Null>,<Null>,*    Fort St. James,British Columbia,"Oblate missionary in northern British Columbia , wrote ""Athapaskan dictionary""","Missionnaire oblat dans le nord de la Colombie-Britannique, auteur d'«Un dictionnaire Athabascan»",54.44905,-124.264058
"Morin, Augustin Norbert","Morin, Augustin Norbert",<Null>,<Null>,*    Saint-Michel-de-Bellechasse,Quebec,"Co-leader in the Reform Coalition of 1851-54, Superior Court Justice (1855)","Co-leader de la Coalition réformiste de 1851 à 1854, juge à la Cour supérieure (1855)",46.871868,-70.910303
"Morrice, James Wilson","Morrice, James Wilson",<Null>,<Null>,Montréal,Quebec,"Landscape painter, contemporary of J. M. Whistler and H. Matisse","Peintre paysagiste, contemporain de J. M. Whistler et de H. Matisse",45.5,-73.6
"Morris, Alexander","Morris, Alexander",Corner of Main Street and Montreal Ave east,Morris and District Centennial Museum,Morris,Manitoba,"Politician, Great Coalition of 1864, first Chief Justice of Manitoba (1872)","Homme politique, Grande coalition de 1864, premier juge en chef du Manitoba (1872)",49.350852,-97.364095
"Morton, Arthur Silver","Morton, Arthur Silver",Campus Drive,"wall inside Murray Building, University of Saskatchewan",Saskatoon,Saskatchewan,"Historian, teacher, first Provincial Archivist of Saskatchewan","Historien, enseignant, premier archiviste de la Saskatchewan",52.131253,-106.636857
"Motherwell, William Richard","Motherwell, William Richard",Highway 22,Motherwell NHSC,Abernethy,Saskatchewan,Federal Minister of Agriculture; founded Territorial Grain Growers' Association,Ministre fédéral de l'Agriculture; fondateur de l'Association territoriale des producteurs de céréales,50.720713,-103.425004
"Mowat, Sir Oliver","Mowat, sir Oliver",900 Bay Street,Mounted inside Mowat Block,Toronto,Ontario,"Father of Confederation, Premier of Ontario (1872-96)","Père de la Confédération, premier ministre de l'Ontario (1872-1896)",43.663245,-79.38732
"Murdoch, Beamish","Murdoch, Beamish",6016 University Ave. (corner Robie St.),in the Public Archives Building,Halifax,Nova Scotia,"Lawyer, politician, author, wrote ""Epitome of the Laws of Nova Scotia"" (1832-33)","Avocat, homme politique, auteur, autheur de «Epitome of the Laws of Nova Scotia» (1832-1833)",44.637615,-63.586011
"Murphy, Emily Ferguson 'Janey Canuck'","Murphy, Emily Ferguson 'Janey Canuck'",Emily Murphy Park Road NW,Emily Murphy Park,Edmonton,Alberta,"First woman judge in British Commonwealth, fought for women's rights","Première femme magistrat du Commonwealth britannique, milita pour les droits des femmes",53.533699,-113.537401
"Murray, James","Murray, James",<Null>,<Null>,*    Québec,Quebec,"Governor of Quebec (1764-68), Military Governor of Quebec District (1760-64)","Gouverneur de la province de Québec (1764-1768), gouverneur militaire du district de Québec (1760-1764)",46.816667,-71.216667
"Murray, Rear Admiral Leonard Warren","Murray, contre-amiral Leonard Warren","Upper Road, Highway 348",Presbyterian Church,Pictou,Nova Scotia,Organized the Allies' North Atlantic Convoy System during World War II,Organisa les convois dans l'Atlantique Nord pendant la Seconde Guerre mondiale,45.664167,-62.686944
"Musgrave, Sir Anthony","Musgrave, sir Anthony",<Null>,<Null>,Victoria,British Columbia,"Governor of Newfoundland (1864-69) and British Columbia (1869-71), led British Columbia into Confederation","Gouverneur de Terre-Neuve (1864-1869) et la Colombie-Britannique (1869-1871), prépara l'entrée de Colombie-Britannique dans la Confédération",48.419093,-123.342496
"Naismith, James","Naismith, James","Highway 15, north of Almonte near Clayton Sideroad",<Null>,**   Almonte,Ontario,"Physician, inventor of basketball, promoter of physical education","Médecin, inventeur du basketball, partisan de l'éducation physique",45.241758,-76.231153
Neekaneet (Foremost Man),Neekaneet (Foremost Man),<Null>,<Null>,Maple Creek,Saskatchewan,"Plains Cree chief, followers settled in Cypress Hills in 1880s",Chef des cris des plaines qui se sont établis dans les collines du Cypress dans les années 1880,49.916667,-109.483333
"Neilson, John","Neilson, John",<Null>,<Null>,*    Québec,Quebec,"Journalist, reformer, Member of the Assembly of Lower Canada (1818-33, 1841-44)","Journaliste, réformateur, député à l'Assemblée législative du Bas-Canada (1818-1833, 1841-1844)",46.813806,-71.208029
"Nelligan, Émile","Nelligan, Émile",<Null>,<Null>,*    Montréal,Quebec,"Poet, member of ""L'École littéraire de Montréal""","Poète, membre de l'École littéraire de Montréal",45.5,-73.6
Nescambiouit,Nescambiouit,<Null>,Abenaki Museum,*    Odanak,Quebec,His perseverance and sense of commitment to his people gave hope to the Abenakis in their struggle to maintain their autonomy and territorial integrity,Sa persévérance et son dévouement envers son peuple ont donné à la nation abénakise l'espoir de conserver son autonomie et son intégrité territoriale,46.072423,-72.822157
"Newcomb, Simon","Newcomb, Simon",Highway 6,<Null>,Wallace Bridge,Nova Scotia,"Astronomer, United States Naval Observatory, director of the Nautical Almanac (1877-97)","Astronome, Naval Observatory des État-Unis, directeur de «Nautical Almanach» (1877-97)",45.812587,-63.514194
"Newton, Gilbert Stuart","Newton, Gilbert Stuart",6100 University Ave.,"Dalhousie University, School of Business Administration, Kenneth C. Rowe Management Building",Halifax,Nova Scotia,"Painter, member of the Royal Academy (1834-35)","Peintre, membre de la Royal Academy (1834-1835)",44.637162,-63.588301
"Newton, Margaret","Newton, Margaret",195 Dafoe Road,University of Manitoba,Winnipeg,Manitoba,"Contributed to scientific information on rust-resistant grains, rust diseases and wheat stem rust","A contribué à enrichir la connaissance scientifique sur les céréales résistantes à la rouille, la rouille et la rouille de la tige du blé",49.809301,-97.129765
"Nincheri, Guido","Nincheri, Guido",1832 Pie IX Boulevard,<Null>,*    Montréal,Quebec,Lasting and significant contribution to the decoration of Canadian churches during the first half of the 20th century,Une contribution durable et importante à la décoration des églises canadiennes pendant la première moitié du XXe siècle,45.550044,-73.540591
"Nobbs, Percy Erskine","Nobbs, Percy Erskine",690 Sherbrooke Street,McCord Museum,*    Montréal,Quebec,Left a legacy of remarkable buildings and designs that were representative of his commitment to Canada's historical building traditions,A laissé en héritage des bâtiments et des dessins d'architecture caractéristiques de son attachement à la tradition du bâtiment au Canada,45.504354,-73.573621
"Noble, Charles Sherwood","Noble, Charles Sherwood",<Null>,<Null>,Nobleford,Alberta,"Agricultural inventor and entrepreneur, began company which produced much of the machinery required to dry-land farm successfully",Inventeur agricole et entrepreneur qui lança une compagnie produisant une bonne partie des instruments aratoires nécessaires à une culture efficace en sol aride,49.882182,-113.052955
"Norquay, John","Norquay, John",450 Broadway,River Walk Park behind Manitoba Legislative Building,Winnipeg,Manitoba,"Premier of Manitoba (1878-87), Métis statesman","Premier ministre du Manitoba (1878-1887), homme politique métis",49.882917,-97.14575
"Notman, William","Notman, William",<Null>,<Null>,*    Montréal,Quebec,Famous Canadian 19th-century photographer,Important photographe canadien du XIXe siècle,45.5,-73.6
"Oaks, Harold Anthony 'Doc'","Oaks, Harold Anthony «Doc»",958 Ferry Road,"Western Canada Aviation Museum, Winnipeg Airport",Winnipeg,Manitoba,"Pioneer bush pilot, founded Patricia Airways (1926)","Pionnier dans le domaine de l'aviation de brousse, fondateur de Patricia Airways (1926)",49.895778,-97.22093
"Odell, Jonathan","Odell, Jonathan",808 Brunswick St. (corner of Church St.),"On the grounds of the ""Deanery""",Fredericton,New Brunswick,"Clergyman, surgeon, poet, Secretary of New Brunswick (1784-1812)","Écclésiastique, médecin, poète, secrétaire du Nouveau-Brunswick (1784-1812)",45.957139,-66.635829
"Ogilvie, William","Ogilvie, William",<Null>,On a rock on the site of the Commissioner's Residence,Dawson,Yukon Territory,"Surveyor, author, Commissioner of Yukon (1898-1901)","Arpenteur, auteur, commissaire du Yukon (1898-1901)",64.058506,-139.438766
"Olesków, Joséf","Olesków, Joséf",100 Main Street South,City Hall,Dauphin,Manitoba,Profound impact on Ukrainian settlement in the West,Impact considérable sur la colonisation des Ukrainiens de l'Ouest,51.148288,-100.051228
"Oliver, Frank","Oliver, Frank",Jasper Ave and 100th Street,Frank Oliver Memorial Park,Edmonton,Alberta,"Pioneer western journalist, Minister of the Interior (1905-11)","Pionnier du journalisme dans l'Ouest, ministre de l'Intérieur (1905-1911)",53.54025,-113.490033
"Oppenheimer, David","Oppenheimer, David",100 Powell Street,Former Oppenheimer Brothers Building,*    Vancouver,British Columbia,Epitomizes the impact of a small but significant Jewish community upon the early development of British Columbia and the exceptional integration of that community into mainstream society,"Symbolise l'impact qu'a eu une communauté juive, peu nombreuse mais influente, sur le développement de la Colombie-Britannique dans sa période initiale",49.28324,-123.102105
Oronhyatekha,Oronhyatekha,County Road 2 / Church Lane,Her Majesty's Christ Church Chapel NHSC,Tyendinaga Mohawk Territory,Ontario,First accredited Aboriginal medical doctor in Canada,Premier Autochtone diplômé en médecine au Canada,44.185417,-77.073717
"Osler, Sir William","Osler, sir William",3655 promenade Sir-William-Osler,<Null>,Montréal,Quebec,"Medical researcher and educator, essays won a wide popular audience","Médecin, chercheur et professeur, auteur d'essais qui obtinrent un grand succès",45.502581,-73.582048
"Palmer, Daniel David","Palmer, Daniel David",175 Water Street,Palmer Memorial Park,Port Perry,Ontario,Creator and popularizer of the practice of chiropractic medicine,Élabora la première théorie de la chiropratique et popularisa cette méthode thérapeutique,44.105375,-78.942155
"Palmer, Edward","Palmer, Edward",165 Richmond Street,north east side of Province House NHSC,Charlottetown,Prince Edward Island,"Father of Confederation, Premier of Prince Edward Island (1859-63)","Père de la Confédération, premier ministre de l'Île-du-Prince-Édouard (1859-1863)",46.23525,-63.1258
"Panadis, Théophile","Panadis, Théophile",<Null>,along the river Saint-François,*    Odanak,Quebec,"Safeguarded and perpetuated Abenaki traditions, thus contributing to the strength and influence of the Abenaki arts and identity",A sauvegardé et perpétué les traditions abénaquises et ainsi contribué pour beaucoup à l'affirmation de l'identité et de l'art abénaquis et à leur rayonnement,46.072423,-72.822157
"Papineau, Louis-Joseph","Papineau, Louis-Joseph",440 Bonsecours Street,<Null>,*    Montréal,Quebec,"Famous French-Canadian nationalist, seigneur at Montebello","Célèbre nationaliste Canadien-français, seigneur de Montebello",45.509875,-73.551725
"Parent, Étienne","Parent, Étienne",<Null>,<Null>,*    Beauport,Quebec,"Journalist, editor of ""Le Canadien"" (1822-25, 1831-42)","Journaliste, rédacteur du journal «Le Canadien» (1822-1825, 1831-1842)",46.866667,-71.183333
"Parker, Elizabeth","Parker, Elizabeth",<Null>,"Eliazbeth Parker Hut, Lake O'Hara",*    Yoho National Park of Canada,British Columbia,"Co-founded, with Arthur Wheeler, Canada's first and pre-eminent alpine club, the Alpine Club of Canada (ACC)","Avec Arthur Oliver Wheeler, elle a fondé le distingué Club Alpin du Canada, première société du genre au pays",51.355,-116.343333
"Parker, Sir Gilbert","Parker, sir Gilbert",209 Pinnacle Street,"inside church, Old Corby Public Library",Belleville,Ontario,Author of popular historical and romantic novels,Auteur de populaires romans historiques et romantiques,44.16396,-77.382534
"Parkin, Sir George","Parkin, sir George",<Null>,New Brunswick Museum,Saint John,New Brunswick,Prominent leader of Imperial Federation Movement,L'un des principaux leaders du l'Imperial Federation Movement,45.269115,-66.081857
"Parlby, Mary Irene","Parlby, Mary Irene",<Null>,Alix Lake Park at the end of Main Street,Alix,Alberta,"Legislator, fought for admission of women to Senate","Législatrice, lutta pour ouvrir les portes du Sénat aux femmes",52.397938,-113.183128
"Parry, Sir William Edward","Parry, sir William Edward",<Null>,<Null>,*    Melville Island,Northwest Territories,"Arctic explorer, led three Northwest Passage expeditions","Explorateur de l'Arctique, dirigea trois expéditions au passage du Nord-Ouest",74.765235,-110.637907
"Patterson, Walter","Patterson, Walter",<Null>,<Null>,Charlottetown,Prince Edward Island,"First Governor of Prince Edward Island (1769-87), presided over land-tenure struggles","Premier gouverneur de l'Île-du-Prince-Édouard(1769-1787), leader dans les luttes relatives aux concessions de terres",46.234807,-63.126848
"Pearce, William","Pearce, William",17A St SE,Pearce Estate,Calgary,Alberta,"Government surveyor, planner for development of western Canada","Topographe fonctionnaire, participa à la planification du développement de l'Ouest canadien",51.042417,-114.0138
"Pearson, Lester Bowles","Pearson, Lester Bowles",<Null>,<Null>,*    Ottawa,Ontario,Prime Minister of Canada (1963-68); Nobel Peace Prize (1956),"Premier ministre du Canada (1963-1968), Prix Nobel de la Paix (1956)",45.440019,-75.694612
"Peel, Paul","Peel, Paul",<Null>,Fanshawe Pioneer Village,London,Ontario,Prominent Canadian painter of the French Academic School,"Peintre canadien important, membre de l'École académique de France",43.054517,-81.17945
"Pelletier, Wilfrid","Pelletier, Wilfrid",175 Ste-Catherine St.,Place des Arts,Montréal,Quebec,"Conductor, founder of the Conservatoire de Musique","Chef d'orchestre, fondateur du Conservatoire de musique",45.508717,-73.565233
"Penfield, Wilder Graves","Penfield, Wilder Graves",<Null>,<Null>,Montréal,Quebec,Founder and director of the Montréal Neurological Institute,Fondateur et directeur de l'institut de neurologie de Montréal,45.5,-73.6
"Perkins, Simeon","Perkins, Simeon",115 Main Street,Perkins House,Liverpool,Nova Scotia,"Merchant, diarist, legislator (1765-99)","Marchand, chroniqueur, législateur (1765-1799)",44.040234,-64.711919
"Perrot, Nicolas","Perrot, Nicolas",Queen Street East,"Francis H. Clergue Park, east of City Hall along the St. Mary's River",Sault Ste. Marie,Ontario,"Explorer, interpreter, fur trader and diplomat","Explorateur, interprète, trafiquant de fourrures,diplomate",46.505661,-84.331995
Piapot,Piapot,<Null>,<Null>,Piapot Reserve,Saskatchewan,"Plains Cree chief, fought the Blackfoot in the last Indian Battle (1870)","Chef cri des plaines, se battit contre les Pieds-Noirs lors de la dernière bataille amérindienne (1870)",49.983333,-109.116667
Pitikwahnapiwiyin (Poundmaker),Pitikwahnapiwiyin (Poundmaker),<Null>,<Null>,Cut Knife Hill,Saskatchewan,"Plains Cree chief and spokesman, sought better treaty terms for Saskatchewan bands; Northwest Rebellion 1885","Chef et porte-parole cri des plaines, négocia des traités plus favorables aux bandes de la Saskatchewan; Rébellion du Nord-Ouest",52.766667,-109
"Pitseolak, Peter","Pitseolak, Peter",<Null>,<Null>,Cape Dorset,Nunavut,"Artist, photographer, hunter and historian","Artiste, photographe, chasseur et historien",64.233333,-76.541667
"Plaskett, John Stanley","Plaskett, John Stanley",5071 West Saanich Road,Dominion Astrophysical Observatory,Saanich,British Columbia,First director of the Dominion Astrophysical Observatory in Victoria (1917),"Premier directeur de l'Observatoire fédéral d'astrophysique, Victoria (1917)",48.519819,-123.418289
"Pond, Peter","Pond, Peter",Shelbrook Highway,5.6 km west,Prince Albert,Saskatchewan,"Explorer and fur trader, one of the founders of the North West Company","Explorateur et trafiquant de fourrures, l'un des fondateurs de la Compagnie du Nord-Ouest",53.205181,-105.857239
"Pope, Georgina Fane","Pope, Georgina Fane",33 Summer Street,On wall of International Fox Museum and Hall of Fame / Old Armoury,Summerside,Prince Edward Island,"Canada's first nursing matron (1908), Army Medical Corps","Première infirmière intendante canadienne (1908), Service de santé de l'Armée royale canadienne",46.392742,-63.790817
"Pope, James Colledge","Pope, James Colledge",<Null>,Howatt's Shore,Lower Bedeque,Prince Edward Island,"Premier of Prince Edward Island, federal Minister of Marine and Fisheries (1878-82)","Premier ministre de l'Île-du-Prince-Édouard, ministre fédéral de la Marine et des pêcheries (1878-1882)",46.347058,-63.728876
"Pope, Sir Joseph","Pope, sir Joseph",<Null>,<Null>,Charlottetown,Prince Edward Island,"Distinguished civil servant (1878-1925), Department of External Affairs, author","Fonctionnaire éminent (1878-1925), ministère des Affaires extérieures, auteur",46.234637,-63.125718
"Pope, William Henry","Pope, William Henry",165 Richmond Street,north east side of Province House NHSC,Charlottetown,Prince Edward Island,Father of Confederation,Père de la Confédération,46.23525,-63.125833
"Pratley, Philip Louis","Pratley, Philip Louis",<Null>,Entrance to the Jacques Cartier Bridge,*    Montréal,Quebec,Canada's foremost designer of long-span highway bridges,Plus grand concepteur de ponts-routes de grande portée au Canada,45.520725,-73.534944
"Pratley, Philip Louis","Pratley, Philip Louis",<Null>,Angus L. Macdonald Bridge,*    Halifax,Nova Scotia,Canada's foremost designer of long-span highway bridges,Plus grand concepteur de ponts-routes de grande portée au Canada,44.663534,-63.584921
"Pratt, E. J.","Pratt, E. J.",<Null>,<Null>,Western Bay,Newfoundland and Labrador,Great Canadian poet,Poète canadien important,47.883333,-53.083333
"Preston, Reverend Richard","Preston, Reverend Richard",5457 Cornwallis Street,Cornwallis Street African United Baptist Church,*    Halifax,Nova Scotia,Leading figure in Nova Scotia's Black community in the first half of the 19th-century,La figure la plus influente de la communauté noire de la Nouvelle-Écosse dans la première moitié du XIXe siècle,44.652667,-63.58366
"Price, Sir William","Price, sir William",<Null>,Price Commemorative Park,*    Kénogami,Quebec,Pioneered the shift from the production of sawn lumber to the production of pulp and paper,Pionnier en réorientant les activités de bois de sciage de ses sociétés vers la production de pâtes et papiers,48.433028,-71.239813
"Provancher, Abbé Léon","Provancher, abbé Léon",1460 Provancher Street,"Église Saint-Félix de Cap-Rouge, right of the entrance",Cap-Rouge,Quebec,Important author on natural sciences,Important auteur du domaine des sciences naturelles,46.749833,-71.344307
"Radisson, Pierre-Esprit","Radisson, Pierre-Esprit",Highway 69/400 crosses the French River,<Null>,French River,Ontario,"Fur trader and explorer, helped found the Hudson's Bay Company (1670)","Trafiquant de fourrures et explorateur, participa à création de Compagnie de Baie d'Hudson (1670)",46.016567,-80.584917
"Ralston, James Layton","Ralston, James Layton",<Null>,on wall of Ralston Building,Halifax,Nova Scotia,"Federal Minister of National Defence (1926-30, 1940-44)","Ministre fédéral de la Défense nationale (1926-1930,1940-1944)",44.645529,-63.571642
"Ravenhill, Alice","Ravenhill, Alice",<Null>,"Ravenhill Residence, University of Victoria",*    Victoria,British Columbia,Highly effective educator as well as a social reformer; affected educational reforms through her work with the British Columbia Women's Institutes,Éducatrice de grand talent et partisane des réformes sociales; a réformé l'éducation en collaborant avec les instituts féminins de la Colombie-Britannique,48.463434,-123.307265
Red Crow,Red Crow,"Junction of Highway 2, Highway 509 and Agriplex entrance road",<Null>,Stand Off,Alberta,"Head Chief of the Blood tribe, signed Treaty Nº 7 in 1877","Grand chef de la tribu des Gens du Sang, signa le traité nº 7 en 1877",49.467991,-113.305478
"Reeves, Chief Justice John","Reeves, juge en chef John",<Null>,<Null>,St. John's,Newfoundland and Labrador,Important Newfoundland jurist and historian,Homme de loi et historien important de Terre-Neuve,47.561464,-52.712784
"Reid, George Agnew","Reid, George Agnew",<Null>,<Null>,Wingham,Ontario,President of the Ontario Society of Artists (1897-1901) and Royal Canadian Academy of Art (1906-09),Président de l'Ontario Society of Artists (1897-1901) et de l'Académie royale canadienne des arts (1906-1909),43.886867,-81.312317
"Richard, Monseignor Marcel-François","Richard, Monseignor Marcel-François",1 Côte nord Street,granite monument in Forgerons Park,Saint-Louis-de-Kent,New Brunswick,"Gave to the Acadian people three symbols of identity: a patron day, a flag and an anthem","A donné au peuple acadien trois symboles auxquels ce dernier s'identifie aujourdhui : une fête patronale, un drapeau et un hymne",46.741863,-64.980886
"Richards, Sir William Buell","Richards, sir William Buell",Court House Square,on outside wall of Leeds and Grenville County Court House NHSC,Brockville,Ontario,First Chief Justice of the Supreme Court of Canada (1875-79),Premier juge en chef de la Cour suprème du Canada (1875-1879),44.590783,-75.68575
"Richardson, Harriette Taber","Richardson, Harriette Taber",Port Royal National Historic Site,on a cairn Port Royal NHSC,Lower Granville,Nova Scotia,Chief proponent of the reconstruction of the Port Royal Habitation,Principal partisan de la reconstruction de l'habitation de Port-Royal,44.711255,-65.609289
